{
  "id": "bank-26",
  "year": 2026,
  "label": "Банк ФИПИ · вариант 26",
  "source": "ФИПИ · открытый банк заданий",
  "totalMinutes": 14,
  "tasks": {
    "1": {
      "prepSeconds": 90,
      "answerSeconds": 20,
      "title": "Пять вопросов к объявлению",
      "situation": "Вы увидели объявление об открытии катка и решили получить дополнительную информацию.",
      "banner": "欢迎来到我们的新滑冰场！",
      "questions": [
        "адрес",
        "часы работы",
        "скидки для студентов",
        "занятия с тренером для взрослых",
        "стоимость одного часа"
      ],
      "image": "assets/variants/bank-26/candidate-01.webp",
      "imageAlt": "Компания катается на коньках в зимнем парке"
    },
    "2": {
      "prepSeconds": 120,
      "answerSeconds": 120,
      "title": "Выберите и опишите фотографию",
      "lead": "Вы показываете семейный альбом своему другу. Говорите не более 2 минут (10–12 фраз).",
      "prompts": [
        "когда и где была сделана фотография",
        "кто на ней изображён",
        "почему Вы сделали эту фотографию",
        "почему решили показать другу именно её"
      ],
      "starter": "我选择第 {n} 号照片……",
      "images": [
        "assets/variants/bank-26/candidate-02.webp",
        "assets/variants/bank-26/candidate-03.webp",
        "assets/variants/bank-26/candidate-04.webp"
      ]
    },
    "3": {
      "prepSeconds": 180,
      "answerSeconds": 180,
      "title": "Проект «Подготовка к экзаменам»",
      "lead": "Вы выполняете вместе с другом проектную работу на тему «Подготовка к экзаменам». Вы нашли фотографии для иллюстрации проекта и решили поделиться этой информацией с другом. Оставьте ему голосовое сообщение. Говорите не более 3 минут (12–15 фраз).",
      "prompts": [
        "дать краткое описание каждой фотографии, объясняя выбор фотографий для проектной работы",
        "сказать, каким образом изображения отличаются друг от друга, объясняя выбор фотографий для проектной работы",
        "описать достоинства и недостатки (1–2) двух разных способов подготовки к экзаменам",
        "выразить Ваше мнение по теме проектной работы – какой способ подготовки к экзаменам является для Вас лучшим и почему"
      ],
      "images": [
        "assets/variants/bank-26/candidate-05.webp",
        "assets/variants/bank-26/candidate-06.webp"
      ],
      "imageLabels": [
        "Подготовка дома в одиночку",
        "Подготовка в библиотеке с товарищами"
      ]
    }
  }
}
