{
  "id": "demo-2024",
  "year": 2024,
  "label": "Демоверсия 2024",
  "source": "ФИПИ · демонстрационный вариант",
  "totalMinutes": 14,
  "tasks": {
    "1": {
      "prepSeconds": 90,
      "answerSeconds": 20,
      "title": "Пять вопросов к объявлению",
      "situation": "Вы увидели объявление о походе в горы и решили получить дополнительную информацию.",
      "banner": "你想去山区旅游吗？跟我们一起去！",
      "questions": ["продолжительность путешествия", "подготовка к путешествию", "питание", "снаряжение", "скидки для студентов"],
      "image": "assets/variants/2024/candidate-01.webp",
      "imageAlt": "Туристы в горах"
    },
    "2": {
      "prepSeconds": 120,
      "answerSeconds": 120,
      "title": "Выберите и опишите фотографию",
      "lead": "Вы показываете семейный альбом своему другу. Говорите не более 2 минут (10–12 фраз).",
      "prompts": ["когда и где была сделана фотография", "кто на ней изображён", "почему Вы сделали эту фотографию", "почему решили показать другу именно её"],
      "starter": "我选择第 {n} 号照片……",
      "images": ["assets/variants/2024/candidate-02.webp", "assets/variants/2024/candidate-03.webp", "assets/variants/2024/candidate-04.webp"]
    },
    "3": {
      "prepSeconds": 180,
      "answerSeconds": 180,
      "title": "Проект «Занятия спортом»",
      "lead": "Оставьте другу голосовое сообщение: объясните выбор иллюстраций и поделитесь идеями о проекте. Говорите не более 3 минут (12–15 фраз).",
      "prompts": ["кратко опишите фотографии и укажите различия", "назовите 1–2 достоинства двух видов спорта", "назовите 1–2 недостатка двух видов спорта", "скажите, какой вид спорта Вы предпочитаете и почему"],
      "images": ["assets/variants/2024/candidate-05.webp", "assets/variants/2024/candidate-06.webp"],
      "imageLabels": ["Футбол", "Плавание"]
    }
  }
}
