{
  "id": "demo-2023",
  "year": 2023,
  "label": "Демоверсия 2023",
  "source": "ФИПИ · демонстрационный вариант",
  "totalMinutes": 14,
  "tasks": {
    "1": {
      "prepSeconds": 90,
      "answerSeconds": 20,
      "title": "Пять вопросов к объявлению",
      "situation": "Вы увидели объявление об открытии спортивного клуба и решили получить дополнительную информацию.",
      "banner": "欢迎你们参加新体育班!",
      "questions": ["адрес клуба", "часы работы", "расписание занятий", "стоимость занятий за месяц", "количество занятий в неделю"],
      "image": "assets/variants/2023/candidate-01.jpg",
      "imageAlt": "Занятие в спортивном клубе"
    },
    "2": {
      "prepSeconds": 120,
      "answerSeconds": 120,
      "title": "Выберите и опишите фотографию",
      "lead": "Вы показываете семейный альбом своему другу. Говорите не более 2 минут (10–12 фраз).",
      "prompts": ["когда и где была сделана фотография", "кто на ней изображён", "почему Вы сделали эту фотографию", "почему решили показать другу именно её"],
      "starter": "我选择第 {n} 号照片……",
      "images": ["assets/variants/2023/candidate-02.jpg", "assets/variants/2023/candidate-03.jpg", "assets/variants/2023/candidate-04.jpg"]
    },
    "3": {
      "prepSeconds": 180,
      "answerSeconds": 180,
      "title": "Проект «Покупки»",
      "lead": "Оставьте другу голосовое сообщение: объясните выбор иллюстраций и поделитесь идеями о проекте. Говорите не более 3 минут (12–15 фраз).",
      "prompts": ["кратко опишите фотографии и укажите различия", "назовите 1–2 достоинства двух способов совершения покупок", "назовите 1–2 недостатка двух способов совершения покупок", "скажите, какой способ совершения покупок Вы предпочитаете и почему"],
      "images": ["assets/variants/2023/candidate-05.jpg", "assets/variants/2023/candidate-06.jpg"],
      "imageLabels": ["Покупки в магазине", "Покупки онлайн"]
    }
  }
}
