{
  "id": "demo-2022",
  "year": 2022,
  "label": "Демоверсия 2022",
  "source": "ФИПИ · демонстрационный вариант",
  "totalMinutes": 14,
  "tasks": {
    "1": {
      "prepSeconds": 90,
      "answerSeconds": 20,
      "title": "Пять вопросов к объявлению",
      "situation": "Вы увидели объявление о соревнованиях по бегу и решили получить дополнительную информацию.",
      "banner": "欢迎你们参加跑步比赛！",
      "questions": ["место проведения", "дата проведения", "организатор мероприятия", "протяжённость забега", "вещи, которые необходимо взять с собой"],
      "image": "assets/variants/2022/candidate-01.jpg",
      "imageAlt": "Участница соревнований пересекает финиш"
    },
    "2": {
      "prepSeconds": 120,
      "answerSeconds": 120,
      "title": "Выберите и опишите фотографию",
      "lead": "Вы показываете семейный альбом своему другу. Говорите не более 2 минут (8–9 фраз).",
      "prompts": ["когда и где была сделана фотография", "кто на ней изображён", "почему Вы сделали эту фотографию", "почему решили показать другу именно её"],
      "starter": "我选择第 {n} 号照片……",
      "images": ["assets/variants/2022/candidate-02.jpg", "assets/variants/2022/candidate-03.jpg", "assets/variants/2022/candidate-04.jpg"]
    },
    "3": {
      "prepSeconds": 180,
      "answerSeconds": 180,
      "title": "Проект «Лучший способ совершения покупок»",
      "lead": "Оставьте другу голосовое сообщение и объясните выбор иллюстраций. Говорите не более 3 минут (12–15 фраз).",
      "prompts": ["кратко опишите фотографии и укажите различия", "назовите 1–2 достоинства двух способов совершения покупок", "назовите 1–2 недостатка двух способов совершения покупок", "скажите, какой способ совершения покупок является для Вас лучшим и почему"],
      "images": ["assets/variants/2022/candidate-05.jpg", "assets/variants/2022/candidate-06.jpg"],
      "imageLabels": ["Покупки офлайн", "Покупки онлайн"]
    }
  }
}
