{
  "id": "bank-01",
  "year": 2026,
  "label": "Банк ФИПИ · вариант 01",
  "source": "ФИПИ · открытый банк заданий",
  "totalMinutes": 14,
  "tasks": {
    "1": {
      "prepSeconds": 90,
      "answerSeconds": 20,
      "title": "Пять вопросов к объявлению",
      "situation": "Вы увидели рекламное объявление об интересной экскурсии и решили получить дополнительную информацию.",
      "banner": "精彩的旅游路线，等你来！",
      "questions": [
        "достопримечательности по маршруту",
        "стоимость билета",
        "дата экскурсии",
        "количество человек в группе",
        "длительность экскурсии"
      ],
      "image": "assets/variants/bank-01/candidate-01.webp",
      "imageAlt": "Мама с сыном на верхнем ярусе экскурсионного автобуса"
    },
    "2": {
      "prepSeconds": 120,
      "answerSeconds": 120,
      "title": "Выберите и опишите фотографию",
      "lead": "Вы показываете семейный альбом своему другу. Говорите не более 2 минут (10–12 фраз).",
      "prompts": [
        "когда и где была сделана фотография",
        "кто на ней изображён",
        "почему Вы сделали эту фотографию",
        "почему решили показать другу именно её"
      ],
      "starter": "我选择第 {n} 号照片……",
      "images": [
        "assets/variants/bank-01/candidate-02.webp",
        "assets/variants/bank-01/candidate-03.webp",
        "assets/variants/bank-01/candidate-04.webp"
      ]
    },
    "3": {
      "prepSeconds": 180,
      "answerSeconds": 180,
      "title": "Проект «Семейные традиции»",
      "lead": "Вы выполняете вместе с другом проектную работу на тему «Семейные традиции». Вы нашли фотографии для иллюстрации проекта, но по техническим причинам не можете сейчас переслать их другу. Оставьте ему голосовое сообщение: объясните свой выбор фотографий и поделитесь некоторыми идеями о проекте. Говорите не более 3 минут (12–15 фраз).",
      "prompts": [
        "объяснить выбор иллюстраций для проектной работы, кратко описав их и указав различия",
        "указать достоинства (1–2) двух семейных традиций",
        "указать недостатки (1–2) двух семейных традиций",
        "выразить Ваше мнение по теме проектной работы – какую из этих семейных традиций Вы предпочитали в детстве и почему"
      ],
      "images": [
        "assets/variants/bank-01/candidate-05.webp",
        "assets/variants/bank-01/candidate-06.webp"
      ],
      "imageLabels": [
        "Новый год у ёлки",
        "Семейный день рождения"
      ]
    }
  }
}
