{
  "id": "bank-23",
  "year": 2026,
  "label": "Банк ФИПИ · вариант 23",
  "source": "ФИПИ · открытый банк заданий",
  "totalMinutes": 14,
  "tasks": {
    "1": {
      "prepSeconds": 90,
      "answerSeconds": 20,
      "title": "Пять вопросов к объявлению",
      "situation": "Вы увидели объявление о кондитерской, которая изготавливает торты на заказ, и решили получить дополнительную информацию.",
      "banner": "我们的定制蛋糕最好吃！",
      "questions": [
        "адрес фирмы",
        "часы работы",
        "виды тортов",
        "сроки изготовления",
        "способы оплаты"
      ],
      "image": "assets/variants/bank-23/candidate-01.webp",
      "imageAlt": "Дети задувают свечи на праздничном торте"
    },
    "2": {
      "prepSeconds": 120,
      "answerSeconds": 120,
      "title": "Выберите и опишите фотографию",
      "lead": "Вы показываете семейный альбом своему другу. Говорите не более 2 минут (10–12 фраз).",
      "prompts": [
        "когда и где была сделана фотография",
        "кто на ней изображён",
        "почему Вы сделали эту фотографию",
        "почему решили показать другу именно её"
      ],
      "starter": "我选择第 {n} 号照片……",
      "images": [
        "assets/variants/bank-23/candidate-02.webp",
        "assets/variants/bank-23/candidate-03.webp",
        "assets/variants/bank-23/candidate-04.webp"
      ]
    },
    "3": {
      "prepSeconds": 180,
      "answerSeconds": 180,
      "title": "Проект «Отдых»",
      "lead": "Вы выполняете вместе с другом проектную работу на тему «Отдых». Вы нашли фотографии для иллюстрации проекта, но по техническим причинам не можете сейчас переслать их другу. Оставьте ему голосовое сообщение: объясните свой выбор фотографий и поделитесь некоторыми идеями о проекте. Говорите не более 3 минут (12–15 фраз).",
      "prompts": [
        "объяснить выбор иллюстраций для проектной работы, кратко описав их и указав различия",
        "указать достоинства (1–2) двух видов отдыха",
        "указать недостатки (1–2) двух видов отдыха",
        "выразить Ваше мнение по теме проектной работы – какой из этих видов отдыха Вы предпочитаете и почему"
      ],
      "images": [
        "assets/variants/bank-23/candidate-05.webp",
        "assets/variants/bank-23/candidate-06.webp"
      ],
      "imageLabels": [
        "Рыбалка на озере",
        "Творчество дома"
      ]
    }
  }
}
