{
  "id": "bank-22",
  "year": 2026,
  "label": "Банк ФИПИ · вариант 22",
  "source": "ФИПИ · открытый банк заданий",
  "totalMinutes": 14,
  "tasks": {
    "1": {
      "prepSeconds": 90,
      "answerSeconds": 20,
      "title": "Пять вопросов к объявлению",
      "situation": "Вы увидели объявление об услугах фотографа и решили получить дополнительную информацию.",
      "banner": "我们拍出最好的照片！快来吧",
      "questions": [
        "цена за час съёмки",
        "выездная съёмка",
        "фотографии большого размера",
        "заказ фотоальбома",
        "срок получения фотографий"
      ],
      "image": "assets/variants/bank-22/candidate-01.webp",
      "imageAlt": "Фотограф снимает на городской улице"
    },
    "2": {
      "prepSeconds": 120,
      "answerSeconds": 120,
      "title": "Выберите и опишите фотографию",
      "lead": "Вы показываете семейный альбом своему другу. Говорите не более 2 минут (10–12 фраз).",
      "prompts": [
        "когда и где была сделана фотография",
        "кто на ней изображён",
        "почему Вы сделали эту фотографию",
        "почему решили показать другу именно её"
      ],
      "starter": "我选择第 {n} 号照片……",
      "images": [
        "assets/variants/bank-22/candidate-02.webp",
        "assets/variants/bank-22/candidate-03.webp",
        "assets/variants/bank-22/candidate-04.webp"
      ]
    },
    "3": {
      "prepSeconds": 180,
      "answerSeconds": 180,
      "title": "Проект «Подработка (частичная занятость)»",
      "lead": "Вы выполняете вместе с другом проектную работу на тему «Подработка (частичная занятость)». Вы нашли фотографии для иллюстрации проекта, но по техническим причинам не можете сейчас переслать их другу. Оставьте ему голосовое сообщение: объясните свой выбор фотографий и поделитесь некоторыми идеями о проекте. Говорите не более 3 минут (12–15 фраз).",
      "prompts": [
        "объяснить выбор иллюстраций для проектной работы, кратко описав их и указав различия",
        "указать достоинства (1–2) двух видов работы с частичной занятостью",
        "указать недостатки (1–2) двух видов работы с частичной занятостью",
        "выразить Ваше мнение по теме проектной работы – какой из этих видов работы с частичной занятостью Вы бы предпочли и почему"
      ],
      "images": [
        "assets/variants/bank-22/candidate-05.webp",
        "assets/variants/bank-22/candidate-06.webp"
      ],
      "imageLabels": [
        "Подработка уборщицей",
        "Подработка официанткой"
      ]
    }
  }
}
