{
  "id": "bank-25",
  "year": 2026,
  "label": "Банк ФИПИ · вариант 25",
  "source": "ФИПИ · открытый банк заданий",
  "totalMinutes": 14,
  "tasks": {
    "1": {
      "prepSeconds": 90,
      "answerSeconds": 20,
      "title": "Пять вопросов к объявлению",
      "situation": "Вы увидели объявление о летнем лагере на берегу моря и решили получить дополнительную информацию.",
      "banner": "暑假里去海边吧！",
      "questions": [
        "сроки",
        "стоимость",
        "место",
        "программа мероприятий",
        "условия проживания"
      ],
      "image": "assets/variants/bank-25/candidate-01.webp",
      "imageAlt": "Группа детей на морском берегу"
    },
    "2": {
      "prepSeconds": 120,
      "answerSeconds": 120,
      "title": "Выберите и опишите фотографию",
      "lead": "Вы показываете семейный альбом своему другу. Говорите не более 2 минут (10–12 фраз).",
      "prompts": [
        "когда и где была сделана фотография",
        "кто на ней изображён",
        "почему Вы сделали эту фотографию",
        "почему решили показать другу именно её"
      ],
      "starter": "我选择第 {n} 号照片……",
      "images": [
        "assets/variants/bank-25/candidate-02.webp",
        "assets/variants/bank-25/candidate-03.webp",
        "assets/variants/bank-25/candidate-04.webp"
      ]
    },
    "3": {
      "prepSeconds": 180,
      "answerSeconds": 180,
      "title": "Проект «Счастливое детство»",
      "lead": "Вы выполняете вместе с другом проектную работу на тему «Счастливое детство». Вы нашли фотографии для иллюстрации проекта и решили поделиться этой информацией с другом. Оставьте ему голосовое сообщение. Говорите не более 3 минут (12–15 фраз).",
      "prompts": [
        "дать краткое описание каждой фотографии, объясняя выбор фотографий для проектной работы",
        "сказать, каким образом изображения отличаются друг от друга, объясняя выбор фотографий для проектной работы",
        "описать достоинства и недостатки (1–2) двух разных видов детского досуга",
        "выразить Ваше мнение по теме проектной работы – какой из видов досуга Вы бы выбрали в детстве и почему"
      ],
      "images": [
        "assets/variants/bank-25/candidate-05.webp",
        "assets/variants/bank-25/candidate-06.webp"
      ],
      "imageLabels": [
        "Игры во дворе",
        "Чтение книг"
      ]
    }
  }
}
