{
  "id": "bank-12",
  "year": 2026,
  "label": "Банк ФИПИ · вариант 12",
  "source": "ФИПИ · открытый банк заданий",
  "totalMinutes": 14,
  "tasks": {
    "1": {
      "prepSeconds": 90,
      "answerSeconds": 20,
      "title": "Пять вопросов к объявлению",
      "situation": "Вы увидели объявление об уроках игры на пианино и решили получить дополнительную информацию.",
      "banner": "我们教音乐！和我们一起学习音乐！",
      "questions": [
        "уроки для начинающих взрослых",
        "бесплатный пробный урок",
        "количество занятий в неделю",
        "вечерние занятия",
        "стоимость обучения"
      ],
      "image": "assets/variants/bank-12/candidate-01.webp",
      "imageAlt": "Дети за роялем на уроке музыки"
    },
    "2": {
      "prepSeconds": 120,
      "answerSeconds": 120,
      "title": "Выберите и опишите фотографию",
      "lead": "Вы показываете семейный альбом своему другу. Говорите не более 2 минут (10–12 фраз).",
      "prompts": [
        "когда и где была сделана фотография",
        "кто на ней изображён",
        "почему Вы сделали эту фотографию",
        "почему решили показать другу именно её"
      ],
      "starter": "我选择第 {n} 号照片……",
      "images": [
        "assets/variants/bank-12/candidate-02.webp",
        "assets/variants/bank-12/candidate-03.webp",
        "assets/variants/bank-12/candidate-04.webp"
      ]
    },
    "3": {
      "prepSeconds": 180,
      "answerSeconds": 180,
      "title": "Проект «О вкусах не спорят»",
      "lead": "Вы выполняете вместе с другом проект на тему «О вкусах не спорят». Вы нашли фотографии для иллюстрации проекта и решили поделиться этой информацией с другом. Оставьте ему голосовое сообщение. Говорите не более 3 минут (12–15 фраз).",
      "prompts": [
        "дать краткое описание каждой фотографии, объясняя выбор фотографий для проектной работы",
        "сказать, каким образом изображения отличаются друг от друга, объясняя выбор фотографий для проектной работы",
        "описать достоинства и недостатки (1–2) двух способов просмотра фильмов",
        "выразить Ваше мнение по теме проектной работы – какой способ просмотра фильмов является лучшим для Вас и почему"
      ],
      "images": [
        "assets/variants/bank-12/candidate-05.webp",
        "assets/variants/bank-12/candidate-06.webp"
      ],
      "imageLabels": [
        "Фильм в кинотеатре",
        "Фильм дома"
      ]
    }
  }
}
