{
  "id": "demo-2025",
  "year": 2025,
  "label": "Демоверсия 2025",
  "source": "ФИПИ · демонстрационный вариант",
  "totalMinutes": 14,
  "tasks": {
    "1": {
      "prepSeconds": 90,
      "answerSeconds": 20,
      "title": "Пять вопросов к объявлению",
      "situation": "Вы увидели объявление об открытии хоккейного клуба и решили получить дополнительную информацию.",
      "banner": "欢迎你们加入冰球俱乐部！",
      "questions": ["место проведения занятий", "расписание занятий", "продолжительность одного занятия", "стоимость занятий за месяц", "информация о тренерах"],
      "image": "assets/variants/2025/candidate-01.webp",
      "imageAlt": "Тренировка хоккейного клуба"
    },
    "2": {
      "prepSeconds": 120,
      "answerSeconds": 120,
      "title": "Выберите и опишите фотографию",
      "lead": "Вы показываете семейный альбом своему другу. Говорите не более 2 минут (10–12 фраз).",
      "prompts": ["когда и где была сделана фотография", "кто на ней изображён", "почему Вы сделали эту фотографию", "почему решили показать другу именно её"],
      "starter": "我选择第 {n} 号照片……",
      "images": ["assets/variants/2025/candidate-02.webp", "assets/variants/2025/candidate-03.webp", "assets/variants/2025/candidate-04.webp"]
    },
    "3": {
      "prepSeconds": 180,
      "answerSeconds": 180,
      "title": "Проект «Волонтёрская деятельность»",
      "lead": "Оставьте другу голосовое сообщение: объясните выбор иллюстраций и поделитесь идеями о проекте. Говорите не более 3 минут (12–15 фраз).",
      "prompts": ["кратко опишите фотографии и укажите различия", "назовите 1–2 достоинства двух видов волонтёрской деятельности", "назовите 1–2 недостатка двух видов волонтёрской деятельности", "скажите, какой вид волонтёрской деятельности Вы предпочитаете и почему"],
      "images": ["assets/variants/2025/candidate-05.webp", "assets/variants/2025/candidate-06.webp"],
      "imageLabels": ["Помощь природе", "Помощь животным"]
    }
  }
}
