{
  "id": "bank-15",
  "year": 2026,
  "label": "Банк ФИПИ · вариант 15",
  "source": "ФИПИ · открытый банк заданий",
  "totalMinutes": 14,
  "tasks": {
    "1": {
      "prepSeconds": 90,
      "answerSeconds": 20,
      "title": "Пять вопросов к объявлению",
      "situation": "Вы увидели рекламное объявление о занятиях в клубе верховой езды и решили получить дополнительную информацию.",
      "banner": "欢迎加入我们的骑马班！",
      "questions": [
        "адрес клуба",
        "необходимое оборудование",
        "членский взнос",
        "количество членов клуба",
        "программы для начинающих"
      ],
      "image": "assets/variants/bank-15/candidate-01.webp",
      "imageAlt": "Всадница седлает лошадь на конюшне"
    },
    "2": {
      "prepSeconds": 120,
      "answerSeconds": 120,
      "title": "Выберите и опишите фотографию",
      "lead": "Вы показываете семейный альбом своему другу. Говорите не более 2 минут (10–12 фраз).",
      "prompts": [
        "когда и где была сделана фотография",
        "кто на ней изображён",
        "почему Вы сделали эту фотографию",
        "почему решили показать другу именно её"
      ],
      "starter": "我选择第 {n} 号照片……",
      "images": [
        "assets/variants/bank-15/candidate-02.webp",
        "assets/variants/bank-15/candidate-03.webp",
        "assets/variants/bank-15/candidate-04.webp"
      ]
    },
    "3": {
      "prepSeconds": 180,
      "answerSeconds": 180,
      "title": "Проект «Погода»",
      "lead": "Вы выполняете вместе с другом проектную работу на тему «Погода». Вы нашли фотографии для иллюстрации проекта и решили поделиться этой информацией с другом. Оставьте ему голосовое сообщение. Говорите не более 3 минут (12–15 фраз).",
      "prompts": [
        "объяснить выбор иллюстраций для проектной работы, кратко описав их и указав различия",
        "указать достоинства (1–2) двух видов погоды",
        "указать недостатки (1–2) двух видов погоды",
        "выразить Ваше мнение по теме проектной работы – какую погоду Вы предпочитаете и почему"
      ],
      "images": [
        "assets/variants/bank-15/candidate-05.webp",
        "assets/variants/bank-15/candidate-06.webp"
      ],
      "imageLabels": [
        "Дождливый день",
        "Солнечный день"
      ]
    }
  }
}
